{
  "counts": {
    "ported": 144,
    "rewritten": 8,
    "total": 152
  },
  "rows": [
    {
      "disposition": "ported",
      "path": "src/capture/extractors/_shared.ts",
      "source_blob_oid": "8b4f418686bab4393b2e76c324d904a26a9f7672",
      "source_content_sha256": "8516dadaca3b234291aedd32b5ee273df43bc17346eaafd96aa8b8b7cd9ab7da"
    },
    {
      "disposition": "ported",
      "path": "src/capture/extractors/_turn_meta.ts",
      "source_blob_oid": "9cfacb226d5e48d234f64e33593e0e3a5cd92c85",
      "source_content_sha256": "a03a3f7f25bc2eb56653d97b92f9bfb29feebb7813313d04983be01b56ed95ed"
    },
    {
      "disposition": "ported",
      "path": "src/capture/extractors/claude-code.ts",
      "source_blob_oid": "765738abd3d717ce7ab4c77019e0d171f5db9f3b",
      "source_content_sha256": "2cc487f9c73aa50c00f0ff446b50e694b0d9f4628207bc1839a5d9bffabbd503"
    },
    {
      "disposition": "ported",
      "path": "src/capture/extractors/codex.ts",
      "source_blob_oid": "e3c09e5df27cb1e77429f79f86c077f794135ffa",
      "source_content_sha256": "80628c0b422b0d4ea006a64da0a874307ef8a29c74c9ef6eaee23a1078fa7755"
    },
    {
      "disposition": "ported",
      "path": "src/capture/extractors/cursor.ts",
      "source_blob_oid": "7e1fd9bba47c643701e93d26674262906fbbe548",
      "source_content_sha256": "cccb31853b8f70e357a96741eceffe42d89ff443ca8013e86d31ac838df4a835"
    },
    {
      "disposition": "ported",
      "path": "src/capture/gate.ts",
      "source_blob_oid": "4b54ca9f625715f4a55123718e589f5d0e33203e",
      "source_content_sha256": "fedbf25838dc8ba9348e8b28c4fe4edb862175919fbf87f7693e9d65f620ca88"
    },
    {
      "disposition": "ported",
      "path": "src/capture/git-state.ts",
      "source_blob_oid": "9a1babc973dee13cec416bb70ac2f5e384c64f91",
      "source_content_sha256": "4498f85ca9ea6267158e93a1b50c64300c513294816a4a26d30ea975e818df2e"
    },
    {
      "disposition": "ported",
      "path": "src/capture/granola-source-policy.ts",
      "source_blob_oid": "8664706bde86785fad87f525a6cfbc6bafb9610b",
      "source_content_sha256": "a2d2ad902920f21ab52a41c3f895aa82efeab7488a5d4e6ffdfcb06e44ea1990"
    },
    {
      "disposition": "ported",
      "path": "src/capture/pipeline-core.ts",
      "source_blob_oid": "dfa2bb254be7924bcd4cd66ad1111095494fe577",
      "source_content_sha256": "796d4552723ad1c9e09efa6de9c01716ec2eac810056eb0e47eb306d94fdfa06"
    },
    {
      "disposition": "ported",
      "path": "src/capture/pipeline.ts",
      "source_blob_oid": "ba588cf54ae132e5de8dfcc4668e0281e4ac0da8",
      "source_content_sha256": "5f5b340847d70c3b126c3e73084674fa1b92ab303b7e71104c9b03ea44cfeb87"
    },
    {
      "disposition": "ported",
      "path": "src/capture/sources.ts",
      "source_blob_oid": "f2af9a18271f470beed4c09fd2b425947c455f08",
      "source_content_sha256": "2e86eb8dfe57399308b646d3b12c1e2b8f8ece132389821b9a56499ccf027826"
    },
    {
      "disposition": "ported",
      "path": "src/capture/surfaces/fs-watcher.ts",
      "source_blob_oid": "fb648e121f573e3a121618bb38b347e4d82b4442",
      "source_content_sha256": "f6e8ab8f23becf3b8b5808020f1dd0c774ae05fbe7733a57d14ad32a0bbb2c7b"
    },
    {
      "disposition": "ported",
      "path": "src/capture/surfaces/git-watcher.ts",
      "source_blob_oid": "31ddb70edafae82ee277552a3107b0316fc0caa9",
      "source_content_sha256": "67d1ff5304d5e9d09ebbb71bb34227cffebf266d00b9a25ec17312e713d7827f"
    },
    {
      "disposition": "ported",
      "path": "src/capture/surfaces/granola-poller.ts",
      "source_blob_oid": "ffd7b15f0d4d1bc36f06d37ae344ae2e793343f3",
      "source_content_sha256": "7d1ac043256510cd194613d7aaedf59c6875cf9e93d126383b34bd4ec816f713"
    },
    {
      "disposition": "ported",
      "path": "src/capture/workspace-root.ts",
      "source_blob_oid": "0fd16f664ab5d0506ea9944890d059b837850560",
      "source_content_sha256": "6e1e64ce24104fa806696a0c7e2a9492bba8e5daba902204a150bc684af4546f"
    },
    {
      "disposition": "ported",
      "path": "src/echo-home/adapters/atomic-write.ts",
      "source_blob_oid": "6f1d0dedc983a52ed6d328a26b0724e1b3cc2daa",
      "source_content_sha256": "f0f8db5e3d80843cc50c82af8a88e55054c546e2343364009e6817903ce4b45e"
    },
    {
      "disposition": "ported",
      "path": "src/echo-home/paths.ts",
      "source_blob_oid": "c0acd2f8286d423f263388911391a05787da91d6",
      "source_content_sha256": "81e71cf739120566305c4e2cebeca07b8f60ddef55013c6883abbc66f7a5b607"
    },
    {
      "disposition": "rewritten",
      "path": "src/echo-home/state-paths.ts",
      "source_blob_oid": "bcf30e93c9648868e6ff2c8271059797e9d44773",
      "source_content_sha256": "d1c44e79d28e1d67de07ac7e349def697667d9b53a9472be7cadfaedf74bfd58",
      "target_content_sha256": "786211dd11792df6a905a0778e22a7e625c21803a0234666a4a5bbdcc9822d71"
    },
    {
      "disposition": "rewritten",
      "path": "src/enrich/granola-signals.ts",
      "source_blob_oid": "1dc78fbc0dc0f435e7d9131dece18107c4cdf2ae",
      "source_content_sha256": "f67d1220ed8ad20e8d8d56a74e15fb28d81ee287c52cda90bbede8c6d01fd9d4",
      "target_content_sha256": "104aa2d72ecd3566a11d542a2d2fb30e2e520550acc1c8e39e447e164f0ebfc4"
    },
    {
      "disposition": "ported",
      "path": "src/guards.ts",
      "source_blob_oid": "251a4bfface223c1401441115b55f4e9b9410699",
      "source_content_sha256": "e6099d1aced802ba6125946ad7555b1b2e3ae12d89ea0034decc323410a485be"
    },
    {
      "disposition": "ported",
      "path": "src/logging/index.ts",
      "source_blob_oid": "6570d49a44c72d6e23c4bf35d6c0cd1570e89b8f",
      "source_content_sha256": "a6d36e7d58662ca032320d6ebdec1a2db574a7dafa4715855b2bdd2acc7e0367"
    },
    {
      "disposition": "ported",
      "path": "src/mcp/cursor-workspace-resolver.ts",
      "source_blob_oid": "54d368c9429954cf3497e9af28fbd1386d2a5818",
      "source_content_sha256": "32aaa4f006bf493fb461f4a8651d5a3922e81bd525e2e61fd58e20a5fbcadeee"
    },
    {
      "disposition": "ported",
      "path": "src/mcp/internal/cluster-engine.ts",
      "source_blob_oid": "4841fa8c83487d8210889e657c96034c6fca1911",
      "source_content_sha256": "77f6b1a761aa33465902cba86f6968dff950c4465f0d052f586e4df73bec6d63"
    },
    {
      "disposition": "ported",
      "path": "src/mcp/parse-anchors.ts",
      "source_blob_oid": "da009ade3593b64209a74ce1bab223dc9c542036",
      "source_content_sha256": "1e86b87083f7ec99bb93c5a33cb72a17ed16bbcc172212c7fe9b11c3ec558aae"
    },
    {
      "disposition": "ported",
      "path": "src/mcp/request-log.ts",
      "source_blob_oid": "785c4b2eb0eb4aef78899e58c2a68f794eae0f2e",
      "source_content_sha256": "a9ae2021c868f98e0c56f58559be75f6ee11ee40b4a28496b7713f55d4087e65"
    },
    {
      "disposition": "rewritten",
      "path": "src/mcp/server.ts",
      "source_blob_oid": "324c80146f0a7cda224fb8930804b23dd0dd1362",
      "source_content_sha256": "8bfa27ee1ea9ce227e984fb64786e2bd16d1cb3fb027c2b3235dd86bfb6fc074",
      "target_content_sha256": "ba35001a8d8db99bb17daeff7763920066424669ba07dfd5dca9251d96675efa"
    },
    {
      "disposition": "ported",
      "path": "src/mcp/tools/_cursor.ts",
      "source_blob_oid": "9c7245c322cf1252ac4fdb496c2a9cce13f2d70d",
      "source_content_sha256": "82e74123dde6d96245b33389818c2a7856b7cdb6742fbe4fa079d0aaf7cc5376"
    },
    {
      "disposition": "ported",
      "path": "src/mcp/tools/echo-ping.ts",
      "source_blob_oid": "f851537761da17f5f919168c00d0dca901ec0822",
      "source_content_sha256": "0124eb723b362ff4277ad916d1b4d556be0a2e9fa07928ed8d1a6d386edf95a1"
    },
    {
      "disposition": "ported",
      "path": "src/mcp/tools/echo-resolve-mru.ts",
      "source_blob_oid": "e5cf0b85ffc99f8b683e07454b14cd28f632f4a1",
      "source_content_sha256": "af1e5d61932cdbf9de4620046b67926211faeb1086a2507683938ee01e5ff32d"
    },
    {
      "disposition": "ported",
      "path": "src/mcp/tools/find-clusters.ts",
      "source_blob_oid": "e20ede77d938b1a658afc4b01a2ea5331c6337b5",
      "source_content_sha256": "19b704db2cbe4d7aea3aab6047a0335be6e35597793ea27796d465988f125748"
    },
    {
      "disposition": "ported",
      "path": "src/mcp/tools/get-atom.ts",
      "source_blob_oid": "88bad7dabba0844cc8419132cd4e9cc621aa23cb",
      "source_content_sha256": "ad831336b7809c781593a52430351407a62085d4989404b5c13ea4fe2a233c57"
    },
    {
      "disposition": "ported",
      "path": "src/mcp/tools/get-atoms.ts",
      "source_blob_oid": "8b58922a4c6b65705dd2dee6ab315b7d4aca61e0",
      "source_content_sha256": "0ff3ef6191b0254da9b49cca7e5b0355a90f48e15f0017caf5ec7e04467bee8f"
    },
    {
      "disposition": "ported",
      "path": "src/mcp/tools/recent-work-context.ts",
      "source_blob_oid": "4c3ace6fac88bd16c59c3350faab1e2e492c5fe2",
      "source_content_sha256": "91a825eb9cac05f7755450f560a8d4e789fd9e6006348ebeb5719f2444cc7d74"
    },
    {
      "disposition": "ported",
      "path": "src/mcp/tools/search-memories.ts",
      "source_blob_oid": "9b6e9e4fcc1fb5e6d6744ce83a4a2ac0a63556c2",
      "source_content_sha256": "31f317040f60255a9fc8bcb4b85808f477096501cf8d76718e6a54cc8be20a3e"
    },
    {
      "disposition": "ported",
      "path": "src/mcp/tools/wait-for-new-turns.ts",
      "source_blob_oid": "48a43fb9648e6a0248b0ca2e57db4938342c2af0",
      "source_content_sha256": "aa8298b8dbb4fbdbaa164f76247b332013016e8518b2fa2746f055f2c9d6dd54"
    },
    {
      "disposition": "ported",
      "path": "src/mcp/util/fs-exclusion.ts",
      "source_blob_oid": "0a935a5b82fa3e0f1d54a65ba28dece3d371a08e",
      "source_content_sha256": "4b1ea7cd8227a12652887ec79c9f6bf315a9751a56722487bd6a29422a15e584"
    },
    {
      "disposition": "ported",
      "path": "src/mcp/util/iso8601.ts",
      "source_blob_oid": "fab0828bab9f16ac8a8efd2980e4db7eafee8c63",
      "source_content_sha256": "932ec405684ecd5d3c35682c34b608acb9d6ad7f60970e4bc39a8e23fe2d40d0"
    },
    {
      "disposition": "ported",